timestamp	experiment	hypothesis	morph_p95	entry_p95	idle_p95	errors	score	decision	notes
2026-08-17T13:08Z	000	baseline (frozen)	66.7	83.4	66.7	0	75.93	keep	morph mean 59.24ms; SwiftShader DPR1 CPUx4; harness frozen from here
2026-08-17T13:12Z	001	H1 coarse pointer: opacity crossfade, no SVG goo/blur	66.7	83.4	66.7	0	76.12	keep	morph mean 59.24->58.1ms; real-device win much larger (filter raster removed)
2026-08-17T13:14Z	002	H2 antialias:false (SDF shader self-AA)	66.7	83.4	66.7	0	76.18	keep	morph mean 58.1->57.73ms, median 66.5->50.1ms
2026-08-17T13:16Z	003	H11 alpha:false + setClearColor(page)	66.7	83.4	66.7	0	76.21	keep	compositor per-pixel blend vs DOM removed; idle fps 17.5->17.7
2026-08-17T13:19Z	004	H-new glyph textures: generateMipmaps + trilinear	66.7	83.4	66.7	0	76.44	keep	morph mean 57.54->56.19ms; helps all phases (glyphs sample every frame)
2026-08-17T13:21Z	005	H-new textGroup.visible=false after textOut	66.7	83.4	66.7	0	76.68	keep	morph mean 56.19->54.82ms; idle 18.1->18.6fps; spent glyphs no longer draw
2026-08-17T13:23Z	006	H-new textGroup hidden until textStart + initTexture preupload	66.7	83.4	66.6	0	76.86	keep	entry pctOver33 95.7->95.2; morph/idle delta partly noise; no reveal-frame upload hitch
2026-08-17T13:46Z	feat-dive	feature (not an experiment): click dives into card, detail layer over art	66.7	83.3	66.6	0	77.41	keep	no frozen-metric regression; smoke: desktop click+ESC, mobile tap+close all pass
2026-08-17T14:01Z	feat-meta-layout	feature: narrow band lockups stacked bottom-right (card collision fix)	66.6	83.3	66.7	0	77.26	keep	no regression; screenshots before/after in autoresearch/shots; PC/MO unchanged
2026-08-18T09:40Z	feat-motion	feature: name follows the card on snap commit; relay morph on touch, asymmetric melt on desktop; two-beat dive with honey peel	66.7	83.4	66.7	0	76.96	keep	no regression: baseline 76.88/77.18/77.24 vs 76.87/77.11/76.90 (3 runs each, means 77.10 vs 76.96, inside spread); resting layout byte-identical at 5 viewports; morph start 1613 -> 290ms, mobile double-print 951ms@0.49 -> 33ms@0.08, desktop blank frame gone
2026-08-18T14:20Z	feat-cards	feature: nine card thumbnails redone as one cut-paper series, art moved to hashed URLs	66.7	83.4	66.7	0	77.29	keep	no regression (spread ~0.35); set 199KB -> 136KB; ring screenshots byte-identical across the hashing move; live check: 9/9 images 200 immutable (probe-cards.mjs)
2026-08-18T15:10Z	feat-typo	feature: goo melt removed for a single relay; typography unified on Freesentation (OFL) subsets	50.1	83.4	50.1	0	81.85	keep	3 runs 81.95/81.89/81.72 vs prior 77.2s — outside noise. morph p95 66.7->50.1ms, idle p95 66.7->50.1ms: the SVG filter subtree cost the compositor at rest too. fonts 220KB otf/ttf -> 105KB woff2 subsets, and Hangul no longer falls back
2026-08-18T16:05Z	fix-heading	fix: intro heading was occluded by the ring at every width; lifted clear and retimed its exit	50.1	83.4	50.1	0	81.89	keep	user-reported. heading sat inside the ring hole, which only fit the shorter original string; on 390px the name lost its first syllable for the whole entry. resting screenshots byte-identical, metric unchanged
2026-08-18T06:48Z	000b	session baseline (this machine; SwiftShader one vsync bucket slower than 08-17)	66.6	83.3	66.6	0	77.49	keep	two runs 77.47/77.51; morph mean ~50.2. Historical 81.89 is not comparable across Chromium/SwiftShader. Compare later rows to this.
2026-08-18T06:50Z	007a	H6 skip dissolved honey links (rEnd<=-3 compact)	66.7	83.3	66.6	0	77.51	discard	within noise of 77.49; p95 quantized. Invisible bridges were not the floor.
2026-08-18T06:55Z	007	H7 tight: drop glass lip + scissor the pass to the ring AABB	50	33.4	50	0	90.03	keep	2 runs 89.95/90.11. entry p95 83.3->33.4, median 66.6->16.7, fps 15.7->50; morph mean 50.2->35.8, p95 66.6->50. Empty pixels were the tax. Heading included in AABB (probe-entry 390). Desktop unscissored.
2026-08-18T06:58Z	008a	H11 H6 retry on top of scissor	50.1	33.4	50	0	90.07	discard	within 007 noise (89.95-90.11)
2026-08-18T07:00Z	008b	tighter rotated AABB instead of bounding circle	50	33.4	50	0	89.99	discard	union of the ring is already most of the phone screen
2026-08-18T07:02Z	008c	MAX_PLANES/LINKS 32 -> 16	50	33.4	49.9	0	89.93	discard	morph pctOver33 38 vs 22; compiler already broke at uCount=9
2026-08-18T07:03Z	009	H4 prefers-reduced-motion: cut instead of play (default path unchanged)	50	33.4	50	0	90.04	keep	harness is no-preference so frozen metric is a regression check. reducedMotion:reduce smoke: entry 2.4s (was 9s), canvas+aria-live, 0 errors.
2026-08-18T07:46Z	010	H13 skip tag SDF/fwidth when tag scale is 0	50	33.4	50	0	90.04	discard	within 007 noise; tag field was not the floor
2026-08-18T07:47Z	011	H9 no honey links until interactive	50	33.3	50	0	90.1	discard	entry pctOver33 4.2->1.5 but p95 stayed 33; visual change (unfurl threads) not worth it
2026-08-18T07:49Z	012	H3 tight: shade at 0.75 * min(dpr,2)	33.4	16.8	33.4	0	96.66	keep	2 runs 96.62/96.71. morph p95 50->33.4 mean 35.8->20.2 fps 28->50; entry p95 33.4->16.8. phone backing 1.5 (dpr2/3 -> 585x1266), desktop/tablet unchanged. harness dpr1 looks softer than a real phone.
